<?xml version="1.0" encoding="us-ascii"?>
<database xmlns:xsi="http://www.w3.org/2001/XMLSchema-instance" name="barbora" xsi:noNamespaceSchemaLocation="InventoryPreset.xsd">
	<InventoryPresets version="2">
		<InventoryPreset Name="inventory_kkut_druhySvaty">
			<ClothingPresetRef Name="kkut_druhySvaty" />
			<WeaponPresetRef Name="mace_2_03" />
			<InventoryPresetRef Name="pockets_gambler" />
			<InventoryPresetRef Name="inventory_singleRandomAlcohol" />
			<PresetItem Name="svatyAntonin_saintGameSign" Amount="1" />
			<PresetItem Name="potion_artemisia_high" Amount="1" />
		</InventoryPreset>
		<InventoryPreset Name="inventory_kkut_hospodskySvatych">
			<ClothingPresetRef Name="kkut_hospodskySvatych" />
			<InventoryPresetRef Name="pockets_innkeeper" />
			<PresetItem Name="svatyAntonin_saintGameSign" Amount="1" />
			<PresetItem Name="svatyAntonin_tavernSvatychCellarDoor" Amount="1" />
		</InventoryPreset>
		<InventoryPreset Name="inventory_kkut_jorgPrank">
			<ClothingPresetRef Name="kkut_jorgPrank" />
			<WeaponPresetRef Name="hammer_3_01" />
			<InventoryPresetRef Name="pockets_burgher" />
			<PresetItem Name="svatyAntonin_tavernSvatychCellarDoor" Amount="1" />
			<PresetItem Name="svatyAntonin_saintGameSign" Amount="1" />
			<PresetItem Name="arrow_precise" Amount="12" />
			<PresetItem Name="repairKit_bowyerSmall" Amount="1" />
			<PresetItem Name="potion_painkiller" Amount="1" />
			<PresetItem Name="RerollDiceBadgeSilver" Amount="1" />
			<PresetItem Name="die_Gamblerova_good" Amount="1" />
		</InventoryPreset>
		<InventoryPreset Name="inventory_kkut_prvniSvaty">
			<ClothingPresetRef Name="kkut_prvniSvaty" />
			<WeaponPresetRef Name="hammer_2_01" />
			<InventoryPresetRef Name="pockets_gambler" />
			<InventoryPresetRef Name="inventory_singleRandomAlcohol" />
			<PresetItem Name="player_lockpick" Amount="2" />
			<PresetItem Name="bandage_classic" Amount="1" />
			<PresetItem Name="svatyAntonin_saintGameSign" Amount="1" />
		</InventoryPreset>
		<InventoryPreset Name="inventory_svatyAntonin_bannerChest">
			<InventoryPresetRef Name="inventory_banditLoot_smallAmountOfValuables" />
			<InventoryPresetRef Name="inventory_banditLoot_spareWeapons" />
			<PresetItem Name="wineGood" Amount="2" />
			<PresetItem Name="potion_artemisia_medium" Amount="2" />
			<PresetItem Name="loot_goldenChalice" Amount="1" />
			<PresetItem Name="loot_silverCup" Amount="2" />
			<PresetItem Name="money" Amount="3120" />
		</InventoryPreset>
		<InventoryPreset Name="inventory_svatyAntonin_gamblers">
			<InventoryPresetRef Name="pockets_gambler" />
			<PresetItem Name="svatyAntonin_saintGameSign" Amount="1" />
		</InventoryPreset>
		<InventoryPreset Name="inventory_svatyAntonin_gamblers_dedicatedGambler">
			<InventoryPresetRef Name="clothes_burgher_male" />
			<InventoryPresetRef Name="pockets_villager" />
			<PresetItem Name="svatyAntonin_saintGameSign" Amount="1" />
			<PresetItem Name="ExtraDicebadgeSilver" Amount="1" />
			<PresetItem Name="AntibustDiceBadgePlumb" Amount="1" />
			<PresetItem Name="die_Matematikova" Amount="1" />
			<PresetItem Name="money" Amount="3800" />
		</InventoryPreset>
		<InventoryPreset Name="inventory_svatyAntonin_hensl">
			<PresetItem Name="TunicLong01_m04_C" Amount="1" />
		</InventoryPreset>
		<InventoryPreset Name="inventory_svatyAntonin_lazar">
			<ClothingPresetRef Name="kkut_lazar" />
			<InventoryPresetRef Name="pockets_miner" />
			<InventoryPresetRef Name="inventory_singleRandomAlcohol" />
			<PresetItem Name="bolt_enh_precise" Amount="8" />
			<PresetItem Name="repairKit_bowyerSmall" Amount="1" />
		</InventoryPreset>
		<InventoryPreset Name="inventory_svatyAntonin_francek">
			<ClothingPresetRef Name="kkut_francek" />
			<WeaponPresetRef Name="mace_1_01" />
			<InventoryPresetRef Name="pockets_miner" />
			<InventoryPresetRef Name="inventory_singleRandomAlcohol" />
			<PresetItem Name="repairKit_cobblersSmall" Amount="1" />
			<PresetItem Name="bandage_classic" Amount="1" />
		</InventoryPreset>
		<InventoryPreset Name="inventory_svatyAntonin_anton">
			<ClothingPresetRef Name="kkut_anton" />
			<WeaponPresetRef Name="mace_2_03" />
			<InventoryPresetRef Name="pockets_burgher" />
			<PresetItem Name="bolt_enh_precise" Amount="12" />
			<PresetItem Name="potion_stamina" Amount="1" />
		</InventoryPreset>
	</InventoryPresets>
</database>
