<?xml version='1.0' encoding='us-ascii'?>
<database xmlns:xsi="http://www.w3.org/2001/XMLSchema-instance" name="barbora" xsi:noNamespaceSchemaLocation="InventoryPreset.xsd">
	<InventoryPresets version="2">
		<InventoryPreset Name="inventory_fishermansStash">
			<PresetItem Name="wineGood" Amount="1"/>
			<PresetItem Name="poi_earthworm" Amount="58"/>
			<PresetItem Name="bread" Amount="2"/>
		</InventoryPreset>
		<InventoryPreset Name="inventory_poachersSack">
			<PresetItem Name="money" Amount="380"/>
			<PresetItem Name="skin_wolf" Amount="2"/>
			<PresetItem Name="skin_roe" Amount="7"/>
			<PresetItem Name="skin_boar" Amount="1"/>
		</InventoryPreset>
		<InventoryPreset Name="inventory_tvez_bozena">
			<ClothingPresetRef Name="f_tvez_bozena"/>
			<InventoryPresetRef Name="pockets_herbalist"/>
		</InventoryPreset>
		<InventoryPreset Name="inventory_tvez_concubine">
			<ClothingPresetRef Name="tvez_concubine"/>
			<InventoryPresetRef Name="pockets_herbalist"/>
			<PresetItem Name="herb_dried_mint" Amount="3"/>
			<PresetItem Name="lorebook_onMaidensWar" Amount="1"/>
			<PresetItem Name="paralysisPoison" Amount="1"/>
			<PresetItem Name="soap" Amount="1"/>
			<PresetItem Name="repairKit_tailorsSmall" Amount="1"/>
		</InventoryPreset>
		<InventoryPreset Name="inventory_tvez_aranka">
			<ClothingPresetRef Name="tvez_aranka"/>
			<PresetItem Name="herb_thistle" Amount="2"/>
			<PresetItem Name="herb_salvia" Amount="1"/>
			<PresetItem Name="herb_marigold" Amount="2"/>
			<InventoryPresetRef Name="pockets_villager"/>
		</InventoryPreset>
		<InventoryPreset Name="inventory_tvez_divozenka">
			<ClothingPresetRef Name="tvez_divozenka"/>
			<InventoryPresetRef Name="pockets_herbalist"/>
			<PresetItem Name="perchDried" Amount="2"/>
			<PresetItem Name="herb_chamomile" Amount="28"/>
			<PresetItem Name="herb_dandelion" Amount="14"/>
			<PresetItem Name="herb_comfrey" Amount="5"/>
			<InventoryPresetRef Name="inventory_money_onePig"/>
		</InventoryPreset>
		<InventoryPreset Name="inventory_tvez_kocour" Health="0.06" HealthVariation="0.05">
			<ClothingPresetRef Name="tvez_kocour_battle"/>
			<WeaponPresetRef Name="longsword_5_01_torch"/>
			<InventoryPresetRef Name="pockets_gambler"/>
			<PresetItem Name="player_lockpick" Amount="2"/>
			<PresetItem Name="bandage_classic" Amount="1"/>
			<PresetItem Name="repairKit_cobblersSmall" Amount="1"/>
			<PresetItem Name="potion_stamina" Amount="1" Health="1"/>
			<PresetItem Name="potion_painkiller_high" Amount="1" Health="1"/>
			<PresetItem Name="daggerCommon" Amount="1"/>
			<InventoryPresetRef Name="inventory_pileOfOnion"/>
		</InventoryPreset>
		<InventoryPreset Name="inventory_tvez_marika">
			<ClothingPresetRef Name="tvez_marika"/>
			<InventoryPresetRef Name="inventory_singleRandomPoorSnack"/>
			<PresetItem Name="herb_valerian" Amount="1"/>
			<PresetItem Name="herb_paris" Amount="1"/>
			<PresetItem Name="herb_wormwood" Amount="1"/>
			<InventoryPresetRef Name="inventory_money_lostChange"/>
		</InventoryPreset>
		<InventoryPreset Name="inventory_tvez_pavlena">
			<ClothingPresetRef Name="f_tvez_pavlena"/>
			<InventoryPresetRef Name="pockets_herbalist"/>
		</InventoryPreset>
		<InventoryPreset Name="inventory_tvez_tibor">
			<ClothingPresetRef Name="tvez_tibor"/>
		</InventoryPreset>
		<InventoryPreset Name="inventory_tvez_vasko" Health="0.06" HealthVariation="0.05"> <!--kumansky velitel Vasko-->
			<ClothingPresetRef Name="tvez_vasko"/>
			<WeaponPresetRef Name="tvez_vasko"/>
			<InventoryPresetRef Name="pockets_bandit_heavy"/>
			<InventoryPresetRef Name="inventory_chanceOfSingleBurgherValuable"/>
			<InventoryPresetRef Name="light_torch"/>
			<PresetItem Name="apple" Amount="1" Health="1" HealthVariation="0.3"/>
			<PresetItem Name="repairKit_weaponSmall" Amount="1"/>
			<PresetItem Name="repairKit_bowyerSmall" Amount="1"/>
		</InventoryPreset>
		<InventoryPreset Name="inventory_tvez_vajda" Health="0.12" HealthVariation="0.05">
			<ClothingPresetRef Name="tvez_vajda"/>
			<WeaponPresetRef Name="tvez_vajda"/>
			<InventoryPresetRef Name="pockets_burgher"/>
			<PresetItem Name="ring_silver_gem" Amount="1"/>
		</InventoryPreset>
		<InventoryPreset Name="inventory_kocovnickaCest_gejza">
			<ClothingPresetRef Name="kocovnickaCest_gejza"/>
		</InventoryPreset>
		<InventoryPreset Name="inventory_utopenciStash">
			<PresetItem Name="money" Amount="1380"/>
			<PresetItem Name="poi_vodnik_treasureMap" Amount="1"/>
			<PresetItem Name="wineGood" Amount="1"/>
			<PresetItem Name="duck" Amount="1"/>
		</InventoryPreset>
		<InventoryPreset Name="inventory_vodnikShelf">
			<PresetItem Name="money" Amount="50"/>
			<PresetItem Name="crayfish" Amount="1"/>
		</InventoryPreset>
		<InventoryPreset Name="inventory_vodnikStash">
			<PresetItem Name="money" Amount="130"/>
			<PresetItem Name="poi_vodnik_vodnikovyKalhoty" Amount="1"/>
			<PresetItem Name="perch" Amount="1"/>
		</InventoryPreset>
		<InventoryPreset Name="inventory_vodniksTreasure">
			<PresetItem Name="money" Amount="1250"/>
		</InventoryPreset>
		<InventoryPreset Name="inventory_certuvPrstStash">
			<PresetItem Name="money" Amount="2810"/>
		</InventoryPreset>
		<InventoryPreset Name="inventory_jugAtRuinedHouse">
			<PresetItem Name="money" Amount="300"/>
		</InventoryPreset>
		<InventoryPreset Name="inventory_sackUnderTheLog">
			<PresetItem Name="money" Amount="250"/>
			<PresetItem Name="beefDried" Amount="6" Health="0.81"/>
		</InventoryPreset>
		<InventoryPreset Name="inventory_tvez_man_8"> <!--kumansky pobocnik Jasak-->
			<ClothingPresetRef Name="tvez_man_8"/>
			<WeaponPresetRef Name="tvez_man_8"/>
			<InventoryPresetRef Name="pockets_bandit_medium"/>
			<InventoryPresetRef Name="inventory_chanceOfSingleBurgherValuable"/>
			<PresetItem Name="apple" Amount="1" Health="1" HealthVariation="0.3"/>
			<PresetItem Name="repairKit_weaponSmall" Amount="1"/>
			<PresetItem Name="repairKit_bowyerSmall" Amount="1"/>
			<!-- netreba kapes -->
		</InventoryPreset>
		<InventoryPreset Name="inventory_tvez_man_9"> 
			<ClothingPresetRef Name="tvez_man_9"/>
			<WeaponPresetRef Name="tvez_man_9"/>
			<InventoryPresetRef Name="pockets_bandit_medium"/>
			<InventoryPresetRef Name="inventory_chanceOfSingleBurgherValuable"/>
			<PresetItem Name="pear" Amount="1" Health="1" HealthVariation="0.3"/>
			<PresetItem Name="repairKit_bowyerSmall" Amount="1"/>
			<PresetItem Name="repairKit_armourSmall" Amount="2"/>
			<!-- netreba kapes -->
		</InventoryPreset>
		<InventoryPreset Name="inventory_tvez_man_11"> 
			<ClothingPresetRef Name="tvez_man_11"/>
			<WeaponPresetRef Name="tvez_man_11"/>
			<InventoryPresetRef Name="pockets_bandit_medium"/>
			<PresetItem Name="walnuts" Amount="1" Health="1" HealthVariation="0.3"/>
			<PresetItem Name="repairKit_armourSmall" Amount="1"/>
			<PresetItem Name="repairKit_cobblersSmall" Amount="1"/>
			<!-- netreba kapes -->
		</InventoryPreset>
		<InventoryPreset Name="inventory_tvez_man_12"> 
			<ClothingPresetRef Name="tvez_man_12"/>
			<WeaponPresetRef Name="tvez_man_12"/>
			<InventoryPresetRef Name="pockets_bandit_light"/>
			<PresetItem Name="repairKit_bowyerSmall" Amount="1"/>
			<PresetItem Name="repairKit_weaponSmall" Amount="1"/>
			<InventoryPresetRef Name="inventory_money_pairOfShoes" />
			<InventoryPresetRef Name="inventory_chanceOfSingleBurgherValuable" />
			<!-- netreba kapes -->
		</InventoryPreset>
		<InventoryPreset Name="inventory_tvez_man_5">
			<ClothingPresetRef Name="tvez_man_5"/>
			<InventoryPresetRef Name="pockets_huntsman"/>
		</InventoryPreset>
		<InventoryPreset Name="inventory_tvez_woman_2">
			<ClothingPresetRef Name="tvez_woman_2"/>
			<!-- <InventoryPresetRef Name="pockets_bathmaid"/> -->
		</InventoryPreset>
		<InventoryPreset Name="inventory_tvez_woman_1">
			<ClothingPresetRef Name="tvez_woman_1"/>
			<InventoryPresetRef Name="pockets_villager"/>
		</InventoryPreset>
		<InventoryPreset Name="inventory_tvez_mikolaj">
			<ClothingPresetRef Name="tvez_mikolaj"/>
			<InventoryPresetRef Name="pockets_horseTrader"/>
			<PresetItem Name="hadkaKonaru_crossCountryChestKey" Amount="1"/>
		</InventoryPreset>
		<InventoryPreset Name="inventory_tvez_bibrek">
			<ClothingPresetRef Name="tvez_bibrek"/>
			<PresetItem Name="hadkaKonaru_mountedArcheryChestKey" Amount="1"/>
		</InventoryPreset>
		<InventoryPreset Name="inventory_tvez_man_2">
			<ClothingPresetRef Name="tvez_man_2"/>
			<InventoryPresetRef Name="pockets_villager"/>
		</InventoryPreset>
		<InventoryPreset Name="inventory_tvez_man_4">
			<ClothingPresetRef Name="tvez_man_4"/>
			<InventoryPresetRef Name="weapons_combatLevel_tro"/>
			<InventoryPresetRef Name="pockets_soldiers_all"/>
		</InventoryPreset>
		<InventoryPreset Name="inventory_tvez_man_3">
			<ClothingPresetRef Name="tvez_man_3"/>
			<InventoryPresetRef Name="weapons_combatLevel_tro"/>
			<InventoryPresetRef Name="pockets_soldiers_all"/>
		</InventoryPreset>
		<InventoryPreset Name="inventory_tvez_opilecAVandrak_man_1">
			<InventoryPresetRef Name="clothes_beggar_male"/> 
			<InventoryPresetRef Name="pockets_beggar"/> 
			<InventoryPresetRef Name="weapons_rabble_combatLevel_all"/> 
		</InventoryPreset>
		<InventoryPreset Name="inventory_tvez_wolfDenStash">
			<PresetItem Name="ring_silver_gem" Amount="1" />
			<PresetItem Name="necklace_tin_cross" Amount="1" />
			<PresetItem Name="Spectacles01_m01" Amount="1" />
			<PresetItem Name="money" Amount="40" />
			<PresetItem Name="rabbitMeat" Amount="2" Health="0.48"/>
			<PresetItem Name="lambMeat" Amount="1" Health="0.43"/>
		</InventoryPreset>

	</InventoryPresets>
</database>
