<?xml version="1.0" encoding="us-ascii"?>
<database xmlns:xsi="http://www.w3.org/2001/XMLSchema-instance" name="barbora" xsi:noNamespaceSchemaLocation="InventoryPreset.xsd">
	<InventoryPresets version="2">
		<InventoryPreset Name="inventory_ztracenaCest_gringolet">
			<ClothingPresetRef Name="kzik_horse_gringolet" />
		</InventoryPreset>
		<InventoryPreset Name="inventory_ztracenaCest_jezek">
			<ClothingPresetRef Name="ztracenaCest_jezek" />
			<WeaponPresetRef Name="ztracenaCest_Jezek" />
			<PresetItem Name="money" Amount="5000" />
			<!-- <PresetItem Name="Spurs01_m01_C" Amount="1" /> Spurs are assigned in Skald -->
			<!-- <PresetItem Name="ztracenaCest_lordsOfHolohlavShield" Amount="1" />  --> <!-- The shield is inside weapon preset -->
			<InventoryPresetRef Name="pockets_villager" />
		</InventoryPreset>
		<InventoryPreset Name="inventory_ztracenaCest_zavis">
			<ClothingPresetRef Name="kzik_zavis" />
			<InventoryPresetRef Name="weapons_longsword_combatLevel_all" />
			<PresetItem Name="ztracenaCest_zavisChest" Amount="1" />
			<InventoryPresetRef Name="pockets_villager" />
		</InventoryPreset>
	</InventoryPresets>
</database>
