<?xml version='1.0' encoding='us-ascii'?>
<database xmlns:xsi="http://www.w3.org/2001/XMLSchema-instance" name="barbora" xsi:noNamespaceSchemaLocation="InventoryPreset.xsd">
	<InventoryPresets version="2">

		<InventoryPreset Name="inventory_ksus_secreMint" Health="0.24" HealthVariation="0.05">
			<PresetItem Name="HoseSeparate01_m09_D" Amount="1"/>
			<PresetItem Name="Hood07_m02_C" Amount="1"/>
			<PresetItem Name="TunicShort08_m09_C" Amount="1" Quality="3" Condition="0.2"/>
			<PresetItem Name="special_sulfur" Amount="6"/>
			<PresetItem Name="potion_nighthawk_medium" Amount="2" Health="1"/>
			<PresetItem Name="special_saltpeter" Amount="8"/>
		</InventoryPreset>

	</InventoryPresets>
</database>
